{
  "implementation_plan": [
    {
      "step_name": "Wire schemas into the agent layer",
      "description": "Make each agent return its Pydantic output model instead of loose dictionaries."
    },
    {
      "step_name": "Validate handoff data",
      "description": "Use each output model as the next agent's input contract."
    },
    {
      "step_name": "Persist structured artifacts",
      "description": "Save validated model dumps as JSON for downstream use."
    }
  ],
  "integration_notes": [
    {
      "from_agent": "Product Planner Agent",
      "to_agent": "Question Power Designer Agent",
      "note": "Use project_goal, target_user, and user_flow to frame the question-power prompt design."
    },
    {
      "from_agent": "Question Power Designer Agent",
      "to_agent": "Quest Designer Agent",
      "note": "Use core_principles and prompt_draft to shape quest activities and interaction patterns."
    },
    {
      "from_agent": "Quest Designer Agent",
      "to_agent": "Growth Mapping Agent",
      "note": "Use quest_types, quest_flow, and sample_quests to define scoring and feedback rules."
    },
    {
      "from_agent": "Growth Mapping Agent",
      "to_agent": "Builder & QA Agent",
      "note": "Use scoring_rules and result_message_rules to plan integration and QA coverage."
    }
  ],
  "qa_checklist": [
    "Does each agent output only the minimum core fields for its role?",
    "Can each downstream input accept the upstream output without field reshaping?",
    "Are all outputs JSON serializable?",
    "Does the structure still match docs/project_context.md?"
  ],
  "qa_issues": [
    {
      "issue": "Prompt drafts may stay too abstract before implementation.",
      "impact": "Later agent behavior could drift without clearer prompt sections.",
      "mitigation": "Refine prompt_draft and few_shot_examples in the next prompt."
    },
    {
      "issue": "Quest and growth rules may diverge over time.",
      "impact": "Scoring could stop reflecting the intended quest behaviors.",
      "mitigation": "Keep Growth Mapping input tied directly to Quest Designer output."
    }
  ],
  "final_summary_points": [
    "The five-agent pipeline now has explicit input and output contracts.",
    "Each output is designed to become the next agent's input with minimal reshaping.",
    "The repository is ready for Prompt 3 to wire these schemas into actual agent implementations."
  ]
}
